Title,Problem type,Objectives / Goals,Metrics Match Objectives?
Sparse and Hierarchical Transformer for Survival Analysis on Whole Slide Images,Methodology,"Show better survival prediction than baselines, and outperform SOTA based on CI.","Partially, ranking metrics match objective, but censoring bias not addressed."
Stable Cox regression for survival analysis under distribution shifts,Methodology,"Build a stable Cox model that improves generalization of risk ranking under distribution shifts, identify stable variables that maintain predictive value across cohorts, evaluate prognostic performance on real-world cancer datasets.","Partially, metrics match risk prediction goal, but censoring bias not addressed."
Survival Analysis for Multimode Ablation Using Self-Adapted Deep Learning Network Based on Multisource Features,Methodology,Benchmark predictive performance of survival models.,"Partially, metrics match objective, but censoring bias is not addressed."
Survival analysis in breast cancer: evaluating ensemble learning techniques for prediction,Application,"Predict time-to-relapse in breast cancer, compare the predictive ability of CoxPH vs. RSF vs. CForest, evaluate model discrimination and prediction error, provide variable importance explanations, illustrate survival probability curves for hypothetical patients.","No, missing TTE metrics and censoring assumptions not addressed."
Survival Analysis of Breast Cancer Patients: A Population-Based Study from SEER,Application,"Predict risk of death, identify significant prognostic features, compare RSF to Cox and Gradient Boosting on predictive performance (predicting ranking, survivability).","No, only ranking is evaluated, even though they imply broader prediction goals and censoring not handled."
Survival Analysis of Superficial Bladder Cancer patients using DeepSurv and Cox models,Application,"Predict risk ranking for bladder cancer patients, rank patients by risk, provide treatment recommendations using hazard ratios/log risk differences, evaluate predictive performance of DeepMLPSurv vs Cox and other models, analyze tumor recurrence based on features.","Partially, metrics align with goal, but censoring-robust metrics are missing."
Survival Kernets: Scalable and Interpretable Deep Kernel Survival Analysis with an Accuracy Guarantee,Methodology,"Develop a deep kernel survival model (survival kernet) that scales to large datasets while remaining interpretable, and provide finite-sample accuracy guarantees for the predicted individual survival distributions.","Partially, metric match their ranking goals, but censoring bias not addressed."
Survival Permanental Processes for Survival Analysis with Time-Varying Covariates,Methodology,The paper proposed a novel Bayesian survival model to estimate a hazard function as a nonlinear regression function of covariates from survival data with time-varying covariates.,"Yes, metrics match goals and censoring bias addressed."
Survival-LCS: A Rule-Based Machine Learning Approach to Survival Analysis,Methodology,"Predict survival times, predict full survival distributions, handle censoring with novel error and accuracy updates, detect complex genetic associations (epistasis, heterogeneity), provide interpretable rule-based models, perform well across varying censoring proportions, feature dimension, and interaction structure.","No, missing TTE metrics, missing calibration, missing ranking, incomplete censoring evaluation."
SurvivalGAN: Generating Time-to-Event Data for Survival Analysis,Methodology,"Formalize synthetic survival data generation, generate time-to-event data that incorporates censored and uncensored data, evaluate quality of generated data.","Partially, missing TTE metrics, but censoring stated as assumed random."
SYNDSURV: A simple framework for survival analysis with data distributed across multiple institutions,Methodology,Distributed synthetic-data survival modeling; claims TTE prediction.,"No, missing TTE metrics, no calibration, and incomplete censoring evaluation."
Tabular GAN-Based Oversampling of Imbalanced Time-to-Event Data for Survival Prediction,Methodology,"Evaluate whether GAN-based oversampling improves balanced survival prediction, assess impacts on survival-prediction performance.","No, missing TTE metrics and calibration, censoring bias is not addressed."
TDMFS: Tucker decomposition multimodal fusion model for pan-cancer survival prediction,Application,"Develop a new multimodal survival model (TDMFS) using Tucker decomposition, improve survival prediction accuracy (ie, risk prediction, not explicit time-to-event estimation), perform risk stratification with Kaplan–Meier curves to show separation of high- vs. low-risk groups.","Partially, proper metrics for risk ranking, but censoring handled poorly; no calibration; not suitable for true time-to-event evaluation."
The AccelerAge framework: a new statistical approach to predict biological age based on time-to-event data,Application,"Predict residual life (survival time) via AFT models, convert residual life into predicted biological age, evaluate biological age clocks using discrimination and calibratrion metrics.","Yes, metrics match risk prediction goal, and they correct for random censoring using Uno's CI."
Time-dependent interpretable survival prediction model for second primary NSCLC patients,Application,"Develop and validate machine-learning-based survival prediction models for overall survival (OS) in SP-NSCLC, predict survival probabilities over time, evaluate time-dependent predictor importance via permutation explanation, risk stratification into high- and low-risk groups via KM curves.","Partially, they use correct metrics for ranking goal, but censoring bias not addressed (no IPCW)"
Time-to-event overall survival prediction in glioblastoma multiforme patients using magnetic resonance imaging radiomics,Application,"Predict time-to-event OS using radiomic + clinical features, identify strong preprocessing / feature selection / ML combinations, stratify patients into risk groups (Kaplan–Meier used for validation).","Partially, Harrell’s CI measures risk ranking, but no IBS, MAE, RMSE, or other time-error metrics are reported."
Toward a Well-Calibrated Discrimination via Survival Outcome-Aware Contrastive Learning,Methodology,Improve discrimination (risk ranking) in deep survival models without sacrificing calibration by using survival-outcome-aware contrastive learning (paired with likelihood training) so that patients with similar event times are embedded closer while keeping well-calibrated survival probabilities.,"Yes, they claim to address discrimination and calibration and evaluate both thoroughly; censoring assumptions stated and handled."
Toward Conditional Distribution Calibration in Survival Prediction,Methodology,"Improve survival probability prediction by post-hoc conformal calibration targeting conditional (covariate-dependent) distribution calibration—aiming to fix both marginal and conditional calibration while preserving discrimination, with theoretical guarantees.","Yes, they claim to address discrimination and calibration and evaluate both thoroughly, censoring assumptions stated and handled."
Towards Robust Time-to-Event Prediction: Integrating the Variational Information Bottleneck with Neural Survival Model,Methodology,"Predict the actual time-to-event (event-time) distribution, estimate survival density and survival function, improve accuracy of time-to-event estimation under noise.","No, metrics do not match TTE objective, censoring bias not addressed."
Transformer-based dynamic survival probability prediction for longitudinal observational data,Methodology,"Predict survival probabilities dynamically over time, model longitudinal measurements, improve prediction accuracy over existing longitudinal survival models, interpretability via SHAP.","No, missing TTE metrics and censoring bias not addressed."
Transformer-based time-to-event prediction for chronic kidney disease deterioration,Methodology,"Predict exact time-to-event (time to deterioration to CKD Stage 5), improve MAE vs. baseline TTE models (explicit claim), predict full survival curves, handle censored data correctly, enable ranking and risk stratification, enable clinical interpretability.","Partially, metrics match some of their objectives (MAE for TTE accuracy, CI for ranking), but the censoring bias unaddressed."
Uncertainty Estimation in Deep Bayesian Survival Models,Methodology,"Assess whether Bayesian NNs improve survival prediction under Cox PH, quantify uncertainty, compare deterministic vs Bayesian models on predictive performance.","Yes, metrics align with objectives and appropriately handle censoring."
Understanding the Impact of Competing Events on Heterogeneous Treatment Effect Estimation from Time-to-Event Data,Methodology,Analyze how competing events induce covariate shift for different causal estimands.,"Yes, RMSE of estimated HTEs is the correct metric for their causal-identification goals."
Prioritising deteriorating patients using time-to-event analysis: prediction model development and internal-external validation,Application,"Use a Cox time-to-event model to improve ranking of patients by risk, compare ranking performance of Cox vs discrete-time logistic regression, develop a model useful for triage prioritization.","Yes, their only concern is ranking and Uno’s AUC handles random censoring properly."
Using Bayesian Neural Networks to Select Features and Compute Credible Intervals for Personalized Survival Prediction,Methodology,"Accurate selection of pertinent features, computation of trustworthy credible intervals (uncertainty), precise estimation of event times or risk scores.","Partially, metrics match the objective, but censoring bias is not addressed."
Using Geographic Location-based Public Health Features in Survival Analysis,Application,"Determine whether adding geographic location-based public health features improves survival prediction quality, evaluate on SEER data using existing models (CoxPH, DSM), prediction goal is framed strictly in terms of agreement between predicted and observed survival times, quantified by CI (ranking), no claims about predicting time-to-event, calibration, or distribution accuracy.","Yes, they make no distributional or censoring-related claims."